{
  "report_type": "livefit_scan_profile",
  "schema_version": "2",
  "manual_photo_capture": false,
  "hardware_required": false,
  "stream_ready": true,
  "foot_detected": true,
  "floor_plane_anchor": true,
  "stable_frame_count": 16,
  "lighting_quality": "good",
  "occlusion_detected": false,
  "optional_depth_sensor": false,
  "camera_angle_quality": "optimal",
  "motion_blur_score": 0.08,
  "scale_anchor_confidence": 0.94,
  "frame_consistency_score": 0.91,
  "estimated_foot_length_mm": 268.0,
  "estimated_foot_width_mm": 97.0,
  "estimated_arch_index": 0.44,
  "scan_confidence": 0.92,
  "decision_status": "pass"
}
